{
  "schema_version": "1.7.1",
  "registry_id": "areg-nabcor",
  "registry_version": 2,
  "supersedes_registry_version": 1,
  "created_at": "2026-07-19T00:08:51Z",
  "decision_ref": "DEC-0015",
  "authorities": [
    {
      "key_id": "k8cc9db703247760829dcb74819fbe07cd1dc24a2bf66ec7a02ed500391de8b1b",
      "subject_id": "ibrahim-mohamed",
      "label": "Ibrahim Mohamed (@ibra2000sd) — Product Owner",
      "algorithm": "ed25519",
      "public_key_spki_b64": "MCowBQYDK2VwAyEAp0Y1G8pBZ+LiOanCJNKqG9SLXwRcME8G59qWJEZIjLM=",
      "roles": ["product-owner"],
      "valid_from": "2026-07-19T00:00:00Z",
      "valid_until": "2027-07-19T00:00:00Z",
      "status": "active"
    }
  ]
}
